,Anonymised Labels ,Author,Column Name,Column Type,Description,File Type,Image Dimension,Keywords,License,No Columns,No Rows,Number of Downloads,Number of views,Size,Summary,Title,URL,Updated
0,,UCI Machine Learning,"[ID, LIMIT_BAL, SEX, EDUCATION, MARRIAGE, AGE, PAY_0, PAY_2, PAY_3, PAY_4, PAY_5, PAY_6, BILL_AMT1, BILL_AMT2, BILL_AMT3, BILL_AMT4, BILL_AMT5, BILL_AMT6, PAY_AMT1, PAY_AMT2, PAY_AMT3, PAY_AMT4, PAY_AMT5, PAY_AMT6, default.payment.next.month]","[numeric, numeric, numeric, numeric, numeric, numeric, numeric, numeric, numeric, numeric, numeric, numeric, numeric, numeric, numeric, numeric, numeric, numeric, numeric, numeric, numeric, numeric, numeric, numeric, numeric]",Dataset Information This dataset contains information on default payments demographic factors credit data history of payment and bill statements of credit card clients in Taiwan from April 2005 to September 2005.  Content There are 25 variables  ID ID of each client LIMIT_BAL Amount of given credit in NT dollars (includes individual and family/supplementary credit SEX Gender (1=male 2=female) EDUCATION (1=graduate school 2=university 3=high school 4=others 5=unknown 6=unknown) MARRIAGE Marital status (1=married 2=single 3=others) AGE Age in years PAY_0 Repayment status in September 2005 (-1=pay duly 1=payment delay for one month 2=payment delay for two months ... 8=payment delay for eight months 9=payment delay for nine months and above) PAY_2 Repayment status in August 2005 (scale same as above) PAY_3 Repayment status in July 2005 (scale same as above) PAY_4 Repayment status in June 2005 (scale same as above) PAY_5 Repayment status in May 2005 (scale same as above) PAY_6 Repayment status in April 2005 (scale same as above) BILL_AMT1 Amount of bill statement in September 2005 (NT dollar) BILL_AMT2 Amount of bill statement in August 2005 (NT dollar) BILL_AMT3 Amount of bill statement in July 2005 (NT dollar) BILL_AMT4 Amount of bill statement in June 2005 (NT dollar) BILL_AMT5 Amount of bill statement in May 2005 (NT dollar) BILL_AMT6 Amount of bill statement in April 2005 (NT dollar) PAY_AMT1 Amount of previous payment in September 2005 (NT dollar) PAY_AMT2 Amount of previous payment in August 2005 (NT dollar) PAY_AMT3 Amount of previous payment in July 2005 (NT dollar) PAY_AMT4 Amount of previous payment in June 2005 (NT dollar) PAY_AMT5 Amount of previous payment in May 2005 (NT dollar) PAY_AMT6 Amount of previous payment in April 2005 (NT dollar) default.payment.next.month Default payment (1=yes 0=no)  Inspiration Some ideas for exploration  How does the probability of default payment vary by categories of different demographic variables? Which variables are the strongest predictors of default payment?  Acknowledgements Any publications based on this dataset should acknowledge the following  Lichman M. (2013). UCI Machine Learning Repository [http//archive.ics.uci.edu/ml]. Irvine CA University of California School of Information and Computer Science. The original dataset can be found here at the UCI Machine Learning Repository.,CSV,,[finance],CC0,,,7492,75028,3,Default Payments of Credit Card Clients in Taiwan from 2005,Default of Credit Card Clients Dataset,https://www.kaggle.com/uciml/default-of-credit-card-clients-dataset,Thu Nov 03 2016
1,,UCI Machine Learning,"[ORIGIN, MOSTYPE, MAANTHUI, MGEMOMV, MGEMLEEF, MOSHOOFD, MGODRK, MGODPR, MGODOV, MGODGE, MRELGE, MRELSA, MRELOV, MFALLEEN, MFGEKIND, MFWEKIND, MOPLHOOG, MOPLMIDD, MOPLLAAG, MBERHOOG, MBERZELF, MBERBOER, MBERMIDD, MBERARBG, MBERARBO, MSKA, MSKB1, MSKB2, MSKC, MSKD, MHHUUR, MHKOOP, MAUT1, MAUT2, MAUT0, MZFONDS, MZPART, MINKM30, MINK3045, MINK4575, MINK7512, MINK123M, MINKGEM, MKOOPKLA, PWAPART, PWABEDR, PWALAND, PPERSAUT, PBESAUT, PMOTSCO, PVRAAUT, PAANHANG, PTRACTOR, PWERKT, PBROM, PLEVEN, PPERSONG, PGEZONG, PWAOREG, PBRAND, PZEILPL, PPLEZIER, PFIETS, PINBOED, PBYSTAND, AWAPART, AWABEDR, AWALAND, APERSAUT, ABESAUT, AMOTSCO, AVRAAUT, AAANHANG, ATRACTOR, AWERKT, ABROM, ALEVEN, APERSONG, AGEZONG, AWAOREG, ABRAND, AZEILPL, APLEZIER, AFIETS, AINBOED, ABYSTAND, CARAVAN]","[string, numeric, numeric, numeric, numeric, numeric, numeric, numeric, numeric, numeric, numeric, numeric, numeric, numeric, numeric, numeric, numeric, numeric, numeric, numeric, numeric, numeric, numeric, numeric, numeric, numeric, numeric, numeric, numeric, numeric, numeric, numeric, numeric, numeric, numeric, numeric, numeric, numeric, numeric, numeric, numeric, numeric, numeric, numeric, numeric, numeric, numeric, numeric, numeric, numeric, numeric, numeric, numeric, numeric, numeric, numeric, numeric, numeric, numeric, numeric, numeric, numeric, numeric, numeric, numeric, numeric, numeric, numeric, numeric, numeric, numeric, numeric, numeric, numeric, numeric, numeric, numeric, numeric, numeric, numeric, numeric, numeric, numeric, numeric, numeric, numeric, numeric]",This data set used in the CoIL 2000 Challenge contains information on customers of an insurance company. The data consists of 86 variables and includes product usage data and socio-demographic data derived from zip area codes. The data was collected to answer the following question Can you predict who would be interested in buying a caravan insurance policy and give an explanation why? Acknowledgements DISCLAIMER This dataset is owned and supplied by the Dutch datamining company Sentient Machine Research and is based on real world business data. You are allowed to use this dataset and accompanying information for non commercial research and education purposes only. It is explicitly not allowed to use this dataset for commercial education or demonstration purposes. For any other use please contact Peter van der Putten info@smr.nl. This dataset has been used in the CoIL Challenge 2000 datamining competition. For papers describing results on this dataset see the TIC 2000 homepage http//www.wi.leidenuniv.nl/~putten/library/cc2000/ Please cite/acknowledge P. van der Putten and M. van Someren (eds) . CoIL Challenge 2000 The Insurance Company Case. Published by Sentient Machine Research Amsterdam. Also a Leiden Institute of Advanced Computer Science Technical Report 2000-09. June 22 2000. The Data Originally this dataset was broken into two parts the training set and the evaluation set. As this was a competition the responses to the evaluation set were not given as part of the original release; they were however released after the end of the competition in a separate file. This dataset contains all three of these files combined into one. The field ORIGIN in the caravan-insurance-challenge.csv file has the values train and test corresponding to the training and evaluation sets respectively. To simulate the original challenge you can ignore the test rows and test your model's prediction on those observations once you've trained only on the training set. Each observation corresponds to a postal code. Variables beginning with M refer to demographic statistics of the postal code while variables beginning with P and A (as well as CARAVAN the target variable) refer to product ownership and insurance statistics in the postal code. The data file contains the following fields  ORIGIN train or test as described above MOSTYPE Customer Subtype; see L0 MAANTHUI Number of houses 1 - 10 MGEMOMV Avg size household 1 - 6 MGEMLEEF Avg age; see L1 MOSHOOFD Customer main type;  see L2  ** Percentages in each group per postal code (see L3)**  MGODRK Roman catholic MGODPR Protestant ... MGODOV Other religion MGODGE No religion MRELGE Married MRELSA Living together MRELOV Other relation MFALLEEN Singles MFGEKIND Household without children MFWEKIND Household with children MOPLHOOG High level education MOPLMIDD Medium level education MOPLLAAG Lower level education MBERHOOG High status MBERZELF Entrepreneur MBERBOER Farmer MBERMIDD Middle management MBERARBG Skilled labourers MBERARBO Unskilled labourers MSKA Social class A MSKB1 Social class B1 MSKB2 Social class B2 MSKC Social class C MSKD Social class D MHHUUR Rented house MHKOOP Home owners MAUT1 1 car MAUT2 2 cars MAUT0 No car MZFONDS National Health Service MZPART Private health insurance MINKM30 Income < 30.000 MINK3045 Income 30-45.000 MINK4575 Income 45-75.000 MINK7512 Income 75-122.000 MINK123M Income >123.000 MINKGEM Average income MKOOPKLA Purchasing power class  ** Total number of variable in postal code (see L4)**  PWAPART Contribution private third party insurance PWABEDR Contribution third party insurance (firms) ... PWALAND Contribution third party insurane (agriculture) PPERSAUT Contribution car policies PBESAUT Contribution delivery van policies PMOTSCO Contribution motorcycle/scooter policies PVRAAUT Contribution lorry policies PAANHANG Contribution trailer policies PTRACTOR Contribution tractor policies PWERKT Contribution agricultural machines policies PBROM Contribution moped policies PLEVEN Contribution life insurances PPERSONG Contribution private accident insurance policies PGEZONG Contribution family accidents insurance policies PWAOREG Contribution disability insurance policies PBRAND Contribution fire policies PZEILPL Contribution surfboard policies PPLEZIER Contribution boat policies PFIETS Contribution bicycle policies PINBOED Contribution property insurance policies PBYSTAND Contribution social security insurance policies AWAPART Number of private third party insurance 1 - 12 AWABEDR Number of third party insurance (firms) ... AWALAND Number of third party insurance (agriculture) APERSAUT Number of car policies ABESAUT Number of delivery van policies AMOTSCO Number of motorcycle/scooter policies AVRAAUT Number of lorry policies AAANHANG Number of trailer policies ATRACTOR Number of tractor policies AWERKT Number of agricultural machines policies ABROM Number of moped policies ALEVEN Number of life insurances APERSONG Number of private accident insurance policies AGEZONG Number of family accidents insurance policies AWAOREG Number of disability insurance policies ABRAND Number of fire policies AZEILPL Number of surfboard policies APLEZIER Number of boat policies AFIETS Number of bicycle policies AINBOED Number of property insurance policies ABYSTAND Number of social security insurance policies CARAVAN Number of mobile home policies 0 - 1  Keys (L1 - L4) L0 Customer subtype  1 High Income expensive child 2 Very Important Provincials 3 High status seniors 4 Affluent senior apartments 5 Mixed seniors 6 Career and childcare 7 Dinki's (double income no kids) 8 Middle class families 9 Modern complete families 10 Stable family 11 Family starters 12 Affluent young families 13 Young all american family 14 Junior cosmopolitan 15 Senior cosmopolitans 16 Students in apartments 17 Fresh masters in the city 18 Single youth 19 Suburban youth 20 Etnically diverse 21 Young urban have-nots 22 Mixed apartment dwellers 23 Young and rising 24 Young low educated  25 Young seniors in the city 26 Own home elderly 27 Seniors in apartments 28 Residential elderly 29 Porchless seniors no front yard 30 Religious elderly singles 31 Low income catholics 32 Mixed seniors 33 Lower class large families 34 Large family employed child 35 Village families 36 Couples with teens 'Married with children' 37 Mixed small town dwellers 38 Traditional families 39 Large religous families 40 Large family farms 41 Mixed rurals  L1 average age keys 1 20-30 years 2 30-40 years 3 40-50 years 4 50-60 years 5 60-70 years 6 70-80 years L2 customer main type keys  1 Successful hedonists 2 Driven Growers 3 Average Family 4 Career Loners 5 Living well 6 Cruising Seniors 7 Retired and Religeous 8 Family with grown ups 9 Conservative families 10 Farmers  L3 percentage keys  0 0% 1 1 - 10% 2 11 - 23% 3 24 - 36% 4 37 - 49% 5 50 - 62% 6 63 - 75% 7 76 - 88% 8 89 - 99% 9 100%  L4 total number keys  0 0 1 1 - 49 2 50 - 99 3 100 - 199 4 200 - 499 5 500 - 999 6 1000 - 4999 7 5000 - 9999 8 10000 - 19999 9 >= 20000 ,CSV,,"[finance, automobiles]",Other,,,1178,12354,2,Identify potential purchasers of caravan insurance policies,Caravan Insurance Challenge,https://www.kaggle.com/uciml/caravan-insurance-challenge,Mon Nov 28 2016
2,,Priya_ds,"[Food.Pinching.Efficiency, Individual, Chopstick.Length]","[numeric, numeric, numeric]",Question As per the 1992 ergonomics study What is the optimum length of chopsticks usable by adults & children? Acknowledgements An investigation for determining the optimum length of chopsticks. Hsu SH Wu SP. Appl Ergon. 1991 Dec;22(6)395-400. PMID 15676839 Inspiration Data Sets shared by a beginner for Beginners ) Thanks to David Venturi and Udacity that I was able to get started off on this. More details here  Link,CSV,,"[food and drink, psychometrics]",Other,,,100,1395,0.0029296875,Evaluate the effects of chopsticks length on food-serving performance,Beginner Projects - Ergonomic Study on Chopsticks,https://www.kaggle.com/priya2908/chopsticks-1992,Mon Jun 12 2017
3,,UCI Machine Learning,[],[],Context The problem is to predict user ratings for web pages (within a subject category). The HTML source of a web page is given. Users looked at each web page and indicated on a 3 point scale (hot medium cold) 50-100 pages per domain. Content This database contains HTML source of web pages plus the ratings of a single user on these web pages. Web pages are on four separate subjects (Bands- recording artists; Goats; Sheep; and BioMedical). Acknowledgement Data originally from the UCI ML Repository. Donated by Michael Pazzani Department of Information and Computer Science University of California Irvine Irvine CA 92697-3425 pazzani@ics.uci.edu Concept based Information Access with Google for Personalized Information Retrieval,Other,,"[web sites, internet]",Other,,,273,2876,2,Automatically Extracting Features for Concept Learning from the Web,Identifying Interesting Web Pages,https://www.kaggle.com/uciml/identifying-interesting-web-pages,Thu Sep 14 2017
4,,mrpantherson,"[, band_name, fans, formed, origin, split, style]","[numeric, string, numeric, numeric, string, numeric, string]",Context The story behind this data set and analysis is just a combination of my interest in data science and metal music.  I was looking for interesting data that I could analyze and this happen to be one of the first I started exploring. Content The world population information was a direct download so I did not have to do any work to get it.  This data set consists of population information for countries on earth from the years 1960 to 2015. The metal band information was scraped from the website http//metalstorm.net/ and consists of the following  - band name  - how many fans the band has on the website   - when the band formed  - when the band split  - the country of origin on the band  - the styles of the band Acknowledgements The metal information was compiled from information found on http//metalstorm.net/ the world population information is from http//www.worldbank.org/. Inspiration There has already been some great analysis of metal bands on Kaggle I wanted to contribute to the discussion by adding some new data and looking at it from a slightly different angle.  Also I thought it might be useful to share the process by which I came up with the visualizations and data management since the community has been a big help to me.,CSV,,"[music, international relations]",CC0,,,349,2863,0.37109375,The data sets within contain information on metal bands and world population,Metal Bands by Nation,https://www.kaggle.com/mrpantherson/metal-by-nation,Thu Feb 16 2017
5,,US Geological Survey,"[COMPOUND, YEAR, STATE_CODE, COUNTY_CODE, LOW_ESTIMATE, HIGH_ESTIMATE]","[string, numeric, numeric, numeric, numeric, numeric]",Content This dataset includes annual county-level pesticide use estimates for 423 pesticides (active ingredients) applied to agricultural crops grown in the contiguous United States. Two different methods were used to estimate a range of pesticide use for all states except California. Both low and high estimate methods incorporated proprietary surveyed rates for United States Department of Agriculture Crop Reporting Districts but the estimates differed in how they treated situations when a district was surveyed and pesticide use was not reported. Low estimates assumed zero use in the district for that pesticide; however high estimates treated the unreported use of pesticides as missing data and estimated the pesticide usage from neighboring locations within the same region. Acknowledgements Data for the state of California was provided by the 2014 Department of Pesticide Regulation Pesticide Use Report. The 2015 report is not yet available.,CSV,,[agriculture],CC0,,,490,4323,24,Which compounds are used most frequently in the United States?,Pesticide Use in Agriculture,https://www.kaggle.com/usgs/pesticide-use,Wed Jan 25 2017
6,,UCI Machine Learning,"[school, sex, age, address, famsize, Pstatus, Medu, Fedu, Mjob, Fjob, reason, guardian, traveltime, studytime, failures, schoolsup, famsup, paid, activities, nursery, higher, internet, romantic, famrel, freetime, goout, Dalc, Walc, health, absences, G1, G2, G3]","[string, string, numeric, string, string, string, numeric, numeric, string, string, string, string, numeric, numeric, numeric, string, string, string, string, string, string, string, string, numeric, numeric, numeric, numeric, numeric, numeric, numeric, numeric, numeric, numeric]",Context The data were obtained in a survey of students math and portuguese language courses in secondary school. It contains a lot of interesting social gender and study information about students.  You can use it for some EDA or try to predict students final grade. Content Attributes for both student-mat.csv (Math course) and student-por.csv (Portuguese language course) datasets   school - student's school (binary 'GP' - Gabriel Pereira or 'MS' - Mousinho da Silveira) sex - student's sex (binary 'F' - female or 'M' - male)  age - student's age (numeric from 15 to 22)  address - student's home address type (binary 'U' - urban or 'R' - rural)  famsize - family size (binary 'LE3' - less or equal to 3 or 'GT3' - greater than 3)  Pstatus - parent's cohabitation status (binary 'T' - living together or 'A' - apart) Medu - mother's education (numeric 0 - none  1 - primary education (4th grade) 2 – 5th to 9th grade 3 – secondary education or 4 – higher education) Fedu - father's education (numeric 0 - none  1 - primary education (4th grade) 2 – 5th to 9th grade 3 – secondary education or 4 – higher education) Mjob - mother's job (nominal 'teacher' 'health' care related civil 'services' (e.g. administrative or police) 'at_home' or 'other')  Fjob - father's job (nominal 'teacher' 'health' care related civil 'services' (e.g. administrative or police) 'at_home' or 'other')  reason - reason to choose this school (nominal close to 'home' school 'reputation' 'course' preference or 'other')  guardian - student's guardian (nominal 'mother' 'father' or 'other')  traveltime - home to school travel time (numeric 1 - <15 min. 2 - 15 to 30 min. 3 - 30 min. to 1 hour or 4 - >1 hour)  studytime - weekly study time (numeric 1 - <2 hours 2 - 2 to 5 hours 3 - 5 to 10 hours or 4 - >10 hours)  failures - number of past class failures (numeric n if 1<=n<3 else 4)  schoolsup - extra educational support (binary yes or no)  famsup - family educational support (binary yes or no)  paid - extra paid classes within the course subject (Math or Portuguese) (binary yes or no)  activities - extra-curricular activities (binary yes or no)  nursery - attended nursery school (binary yes or no)  higher - wants to take higher education (binary yes or no)  internet - Internet access at home (binary yes or no)  romantic - with a romantic relationship (binary yes or no)  famrel - quality of family relationships (numeric from 1 - very bad to 5 - excellent)  freetime - free time after school (numeric from 1 - very low to 5 - very high)  goout - going out with friends (numeric from 1 - very low to 5 - very high)  Dalc - workday alcohol consumption (numeric from 1 - very low to 5 - very high)  Walc - weekend alcohol consumption (numeric from 1 - very low to 5 - very high)  health - current health status (numeric from 1 - very bad to 5 - very good)  absences - number of school absences (numeric from 0 to 93)   These grades are related with the course subject Math or Portuguese   G1 - first period grade (numeric from 0 to 20)  G2 - second period grade (numeric from 0 to 20)  G3 - final grade (numeric from 0 to 20 output target)   Additional note there are several (382) students that belong to both datasets .  These students can be identified by searching for identical attributes that characterize each student as shown in the annexed R file. Source Information P. Cortez and A. Silva. Using Data Mining to Predict Secondary School Student Performance. In A. Brito and J. Teixeira Eds. Proceedings of 5th FUture BUsiness TEChnology Conference (FUBUTEC 2008) pp. 5-12 Porto Portugal April 2008 EUROSIS ISBN 978-9077381-39-7. Fabio Pagnotta Hossain Mohammad Amran.  Emailfabio.pagnotta@studenti.unicam.it mohammadamra.hossain '@' studenti.unicam.it  University Of Camerino https//archive.ics.uci.edu/ml/datasets/STUDENT+ALCOHOL+CONSUMPTION,CSV,,"[food and drink, public health]",CC0,,,18468,108845,0.10546875,"Social, gender and study data from secondary school students",Student Alcohol Consumption,https://www.kaggle.com/uciml/student-alcohol-consumption,Wed Oct 19 2016
7,,Rachael Tatman,[],[],Context Character encodings are sets of mappings from raw bits (0’s and 1’s) to text characters. When a text encoded with a specific encoder is decoded with a different encoder it changes the output text. Sometimes this results in completely unreadable text. This dataset is intended to provide a list of example texts in different character encodings to help you diagnose which file encoding your source file actually in.  Content This dataset is made up of six text files that represent five different character encodings and six different languages. The character encodings represented in this dataset are ISO-8859-1 (also known as Latin 1)  ASCII Windows 1251 UTF-16 that has been successfully converted into the UTF-8 and BIG-5. More information on the files is available in the file_guide.csv file. Each  text file contains a header and footer. The body text is delimited by this text * START OF THE PROJECT GUTENBERG EBOOK [TITLE OF BOOK GOES HERE] * * END OF THE PROJECT GUTENBERG EBOOK [TITLE OF BOOK GOES HERE]* Acknowledgements The texts in this dataset were prepared by Project Gutenberg volunteers. These texts are in the public domain.  Inspiration  Can you build an tool to automatically detect when a file in the wrong encoding is read in? You can use this dataset to explore what happens when you read in text using different encoders. ,Other,,"[writing, languages, linguistics]",CC0,,,21,485,0.9248046875, Example text files for five popular text encodings,Character Encoding Examples,https://www.kaggle.com/rtatman/character-encoding-examples,Sat Dec 16 2017
8,,PyTorch,[],[],SqueezeNet 1.0  SqueezeNet AlexNet-level accuracy with 50x fewer parameters and <0.5MB model size Recent research on deep neural networks has focused primarily on improving accuracy. For a given accuracy level it is typically possible to identify multiple DNN architectures that achieve that accuracy level. With equivalent accuracy smaller DNN architectures offer at least three advantages (1) Smaller DNNs require less communication across servers during distributed training. (2) Smaller DNNs require less bandwidth to export a new model from the cloud to an autonomous car. (3) Smaller DNNs are more feasible to deploy on FPGAs and other hardware with limited memory. To provide all of these advantages we propose a small DNN architecture called SqueezeNet. SqueezeNet achieves AlexNet-level accuracy on ImageNet with 50x fewer parameters. Additionally with model compression techniques we are able to compress SqueezeNet to less than 0.5MB (510x smaller than AlexNet).   Authors Forrest N. Iandola Song Han Matthew W. Moskewicz Khalid Ashraf William J. Dally Kurt Keutzer https//arxiv.org/abs/1602.07360  SqueezeNet Architectures   What is a Pre-trained Model? A pre-trained model has been previously trained on a dataset and contains the weights and biases that represent the features of whichever dataset it was trained on. Learned features are often transferable to different data. For example a model trained on a large dataset of bird images will contain learned features like edges or horizontal lines that you would be transferable your dataset.  Why use a Pre-trained Model? Pre-trained models are beneficial to us for many reasons. By using a pre-trained model you are saving time. Someone else has already spent the time and compute resources to learn a lot of features and your model will likely benefit from it. ,Other,,"[machine learning, pre-trained model]",CC0,,,5,334,4,SqueezeNet 1.1 Pre-trained Model for PyTorch,SqueezeNet 1.1,https://www.kaggle.com/pytorch/squeezenet11,Fri Dec 15 2017
