,Anonymised Labels ,Author,Column Name,Column Type,Description,File Type,Image Dimension,Keywords,License,No Columns,No Rows,Number of Downloads,Number of views,Size,Summary,Title,URL,Updated
184,,University of Michigan,"[court_term, justice_code, justice_name, posterior_mean, standard_deviation, posterior_median, twosigma_left, twosigma_right]","[numeric, numeric, string, numeric, numeric, numeric, numeric, numeric]","Context Measuring the relative location of U.S. Supreme Court justices on an ideological continuum allows us to better understand the politics of the high court. Such measures are an important building blocking of statistical models of the Supreme Court the separation of powers system and the judicial hierarchy. Content The ""Martin-Quinn"" judicial ideology scores are estimated for every justice serving from the October 1937 term to the present. The measures are estimated using a dynamic item response theory model allowing judicial ideology to trend smoothly through time. Since the scores are estimated from a probability model they can be used to form other quantities of interest such as locating the pivotal ""median"" justice as all well the location of each case in the policy space.  Acknowledgements The Martin-Quinn scores were developed by Andrew D. Martin of the University of Michigan and Kevin M. Quinn of the UC Berkeley School of Law and supported by a National Science Foundation grant. The scores are based on the 2016 release of the Supreme Court Database.",CSV,,"[law, politics]",Other,,,84,2200,0.0390625,Measure of individual justices' ideology on political spectrum per term,Ideology Scores of Supreme Court Justices,https://www.kaggle.com/umichigan/court-justices,Fri Feb 10 2017
185,,NASA,"[id, date, time, continent_code, country_name, country_code, state/province, population, city/town, distance, location_description, latitude, longitude, geolocation, hazard_type, landslide_type, landslide_size, trigger, storm_name, injuries, fatalities, source_name, source_link]","[numeric, dateTime, string, string, string, string, string, numeric, string, numeric, string, numeric, numeric, string, string, string, string, string, string, string, numeric, string, string]",Context Landslides are one of the most pervasive hazards in the world causing more than 11500 fatalities in 70 countries since 2007. Saturating the soil on vulnerable slopes intense and prolonged rainfall is the most frequent landslide trigger. Content The Global Landslide Catalog (GLC) was developed with the goal of identifying rainfall-triggered landslide events around the world regardless of size impacts or location. The GLC considers all types of mass movements triggered by rainfall which have been reported in the media disaster databases scientific reports or other sources. Acknowledgements The GLC has been compiled since 2007 at NASA Goddard Space Flight Center.,CSV,,"[geology, climate]",CC0,,,366,3538,0.4208984375,Location and cause of landslide events around the world,"Landslides After Rainfall, 2007-2016",https://www.kaggle.com/nasa/landslide-events,Thu Jan 19 2017
186,,Lantana Camara,"[finishing_position, horse_number, horse_name, horse_id, jockey, trainer, actual_weight, declared_horse_weight, draw, length_behind_winner, running_position_1, running_position_2, running_position_3, running_position_4, finish_time, win_odds, running_position_5, running_position_6, race_id]","[numeric, numeric, string, string, string, string, numeric, numeric, numeric, numeric, numeric, numeric, numeric, numeric, dateTime, numeric, string, string, string]",Can You Predict The Result? Horse racing is one of the sport which involved many gambling activities. Million of people in the world tried to find their 'winning formula' in order to gain profit from betting. Since there are many factors which could affect the race result data analysis on horse racing became much interesting. Hong Kong horse racing is especially interesting due to the follow reasons  - The handicap system made the race more competitive  - Horse pool is small compared to other countries so that horses will meet their rivalries very often in the races  - Limited number of jockey/trainer  - Data are well managed by the official )   The Dataset The dataset contains the race result of 1561 local races throughout Hong Kong racing seasons 2014-16 and more information will be added into the dataset. The dataset is divided into two tables (which can be joined by race_id). Most of the column description can be found below with one extra piece of information finishing_position -  For special incident please refer to here So can you find any pattern for the winner under some condition? Did you spot out a winning strategy? (FYI betting on all horse equally will bring a loss of ~17.5% on average)  Which jockey/trainer is worth to follow? Don't wait and start the data analysis! You may find some of the kernels I created useful. Enjoy! And please remember to share your finding with the community! Acknowledgement The data are extracted from the website of The Hong Kong Jockey Club How to get started? In case you are not familiar with Hong Kong horse racing please see this notebook as a get started tutorial.,CSV,,[horse racing],Other,,,1036,10237,8,"Race details include track, time,  and horse",Hong Kong Horse Racing Results 2014-17 Seasons,https://www.kaggle.com/lantanacamara/hong-kong-horse-racing,Fri Aug 18 2017
187,,The Huffington Post,"[survey_organization, party_affiliation, start_date, end_date, survey_method, survey_question, survey_population, survey_sample, approve_percent, disapprove_percent, undecided_percent, margin_of_error]","[string, string, dateTime, dateTime, string, string, string, numeric, numeric, numeric, numeric, numeric]",Context HuffPost Pollster (originally Pollster.com) aims to report the results of every public poll that claims to provide a representative sample of the population or electorate. We have included polls of varying methodology including automated or recorded voice telephone polls and online surveys using non-probability internet samples. As of 2010 we require all polls from a new organization (or one new to us) to meet all of the minimal disclosure requirements of the National Council on Public Polling. We have always excluded polls that fail to disclose survey dates sample size and sponsorship; however we may now choose in our editorial discretion to exclude polls or pollsters that do not provide sufficient methodological information for us or our readers to determine their quality. Content This dataset lists results from public opinion surveys regarding the president's job approval since 2008. Acknowledgements The presidential approval ratings were provided by the organization listed and aggregated by HuffPost Pollster. Inspiration How does public approval of the president change over time? How do current events and presidential responses impact approval ratings? Can you predict how Trump's approval rating will change over the course of his presidency?,CSV,,[politics],Other,,,201,2652,0.9560546875,Public opinion survey methodology and results since 2008,Presidential Approval Ratings,https://www.kaggle.com/huffingtonpost/presidential-approval,Tue Feb 28 2017
188,,Kyubyong Park,"[ID, HEADWORD, POS, ENGLISH, JAPANESE, SPANISH, INDONESIAN, EXAMPLE (KO), EXAMPLE (EN), EXAMPLE (JA), EXAMPLE (ES), EXAMPLE (ID)]","[numeric, string, string, string, string, string, string, string, string, string, string, string]",Context A few years ago I investigated a Korean corpus in order to find the most frequent 1000 words. Subsequently I asked native speakers to translate those words and their example sentences into English Japanese Spanish and Indonesian. I've totally forgotten this data since then but it flashed on me this might be helpful for some people. Undoubtedly 1000 sentences are a pretty small corpus but it is also true that parallel corpora are hard to get. Content It's a csv file. As you expect the first line is the heading.  ID Id of the headword. It is arranged by alphabetical order. HEADWORD 1000 most frequent Korean words. POS Part of speech. ENGLISH English meaning or equivalent. JAPANESE Japanese meaning or equivalent. SPANISH Spanish meaning or equivalent. INDONESIAN Indonesian meaning or equivalent. EXAMPLE (KO) An example sentence EXAMPLE (EN) English translation EXAMPLE (JA) Japanese translation EXAMPLE (ES) Spanish translation EXAMPLE (ID) Indonesian translation  Inspiration For now I'm not sure how this small corpus can be used. Hopefully this will be helpful for some pilot linguistic project.,CSV,,"[languages, linguistics]",CC4,,,115,1956,0.263671875,"1000 parallel sentences of Korean, English, Japanese, Spanish, and Indonesian",1000 parallel sentences,https://www.kaggle.com/bryanpark/parallelsents,Sun Dec 25 2016
189,,Reason Foundation,"[InventNumb, PolRptNumb, INumber, SeizeDate, SeizeAddress, SeizeCity, SeizeState, SeizeZip, InvItemNumb, Descr, EstValue, Vin, Findings, ForfDate, ForfValue, CaseNumb, AD, ADDate]","[numeric, string, string, dateTime, string, string, string, string, numeric, string, numeric, string, string, dateTime, numeric, string, string, string]","Context ""Law enforcement in Cook County which includes Chicago seized items from residents ranging from a cashier's check for 34 cents to a 2010 Rolls Royce Ghost with an estimated value of more than $200000. They also seized Xbox controllers televisions nunchucks 12 cans of peas a pair of rhinestone cufflinks and a bayonet."" -Reason.com Content There wasn't much documentation on the dataset but the data fields are somewhat explanatory.  InventNumb Inventory number PolRptNumb Police report number INumber ? SeizeDate Date siezed SeizeAddress Address where it was siezed SeizeCity City where it was siezed SeizeState State where it was siezed SeizeZip Zip code for where it was siezed InvItemNumb Invenotry Item number? Descr Description of item EstValue estimated value of item Vin VIN number? (vehicles) Findings ? ForfDate Forfieture date? ForfValue Value of forfieture? CaseNumb Case number AD ? ADDate Date?  Acknowledgements This dataset is the result of FOIA request by Lucy Parsons Labs a Chicago-based transparency non-profit. It contains information about to the seizures of assets in Cook County (Chicago IL). These data were presented in a Reason.com article showing the disparity of Police seizures between poor and wealthier parts of Cook County IL. http//reason.com/blog/2017/06/13/poor-neighborhoods-hit-hardest-by-asset The original excel file was converted to CSV Inspiration This dataset comes from a Freedom of Information Act request. I love datasets like these because of the potential for finding new socioeconomic insights and improving government accountability.",CSV,,[],CC0,,,19,448,3,"A FOIA request for asset forfeiture in Cook County, IL","Cook County Asset Forfeiture (Chicago, IL)",https://www.kaggle.com/reason-foundation/cook-county-asset-forfeiture-chicago-il,Fri Jul 21 2017
190,,Nelson Chu,"[time, station, AMB_TEMP, CH4, CO, NMHC, NO, NO2, NOx, O3, PH_RAIN, PM10, PM2.5, RAINFALL, RAIN_COND, RH, SO2, THC, UVB, WD_HR, WIND_DIREC, WIND_SPEED, WS_HR]","[dateTime, string, numeric, numeric, numeric, numeric, numeric, numeric, numeric, numeric, string, numeric, string, string, string, numeric, numeric, numeric, numeric, numeric, numeric, numeric, numeric]",Context This data is from Environmental Protection Administration Executive Yuan R.O.C. (Taiwan). There is air quality data and meteorological monitoring data for research and analysis (only include northern Taiwan 2015). Content 25 observation stations data in the 2015_Air_quality_in_northern_Taiwan.csv The columns in csv file are  time - The first column is observation time of 2015 station - The second column is station name there is 25 observation stations [Banqiao Cailiao Datong Dayuan Guanyin Guting Keelung Linkou Longtan Pingzhen Sanchong Shilin Songshan Tamsui Taoyuan Tucheng Wanhua Wanli Xindian Xinzhuang Xizhi Yangming Yonghe Zhongli Zhongshan] items - From the third column to the last one item - unit - description SO2 - ppb - Sulfur dioxide CO - ppm - Carbon monoxide O3 - ppb - ozone PM10 - μg/m3 - Particulate matter PM2.5 - μg/m3 - Particulate matter NOx - ppb - Nitrogen oxides NO - ppb - Nitric oxide NO2 - ppb - Nitrogen dioxide THC - ppm - Total Hydrocarbons NMHC - ppm - Non-Methane Hydrocarbon CH4 - ppm - Methane UVB - UVI - Ultraviolet index AMB_TEMP - Celsius - Ambient air temperature RAINFALL - mm RH - % - Relative humidity WIND_SPEED - m/sec - The average of last ten minutes per hour WIND_DIREC - degress - The average of last ten minutes per hour WS_HR - m/sec - The average of hour WD_HR - degress  - The average of hour PH_RAIN - PH - Acid rain RAIN_COND - μS/cm - Conductivity of acid rain  Data mark  # indicates invalid value by equipment inspection * indicates invalid value by program inspection x indicates invalid value by human inspection NR indicates no rainfall blank indicates no data  License Open Government Data License version 1.0 http//data.gov.tw/license,CSV,,[environment],Other,,,840,7312,18,"Air quality monitoring data from northern Taiwan, 2015",Air quality in northern Taiwan,https://www.kaggle.com/nelsonchu/air-quality-in-northern-taiwan,Fri Jul 29 2016
191,,LiamLarsen,"[Date, Time, Tweet_Text, Type, Media_Type, Hashtags, Tweet_Id, Tweet_Url, twt_favourites_IS_THIS_LIKE_QUESTION_MARK, Retweets, , ]","[dateTime, dateTime, string, string, string, string, numeric, string, numeric, numeric, string, string]",Context Unlike This dataset (which proved to be unusable). And This one which was filled with unnecessary columns; This Donald trump dataset has the cleanest usability and consists of over 7000 tweets no nonsense You may need to use a decoder other than UTF-8 if you want to see the emojis Content Data consists of  -Date -Time -Tweet_Text -Type -Media_Type -Hashtags -Tweet_Id -Tweet_Url -twt_favourites_IS_THIS_LIKE_QUESTION_MARK -Retweets  I scrapped this from someone on reddit,CSV,,"[politics, internet]",Other,,,824,9967,2,A collection of all of Donald Trump tweets--better than its predecessors,(Better) - Donald Trump Tweets!,https://www.kaggle.com/kingburrito666/better-donald-trump-tweets,Sun Apr 16 2017
192,,姜上（Integ）,"[#, Good Old Plain JavaScript, ES6, CoffeeScript, TypeScript, Elm, ClojureScript, On a scale of one to five dogs, how happy are you with your current flavor of JavaScript?, No Front-End Framework, React, Angular, Angular 2, Ember, Vue, Backbone, Other Front-End Frameworks, On a scale of one to five cats, how happy are you with your current solution for the front-end?, Redux, MobX, Relay, Other State Management Libraries, On a scale of one to five thunderbolts, how happy are you with your current solution for state management?, Custom REST API, Firebase, GraphQL, Apollo, Falcor, Horizon, Other API layer solutions, On a scale of one to five crowns, how happy are you with your current solution for the API layer?, Meteor, FeathersJS, DoneJS, MERN, MEAN, Other stacks, On a scale of one to five trophies, how happy are you with your current full-stack solution?, Mocha, Jasmine, Enzyme, Jest, Cucumber, Ava, Other testing frameworks, On a scale of one to five severed hands, how happy are you with the current state of JavaScript testing?, Plain CSS, SASS/SCSS, LESS, CSS Modules, Aphrodite, Other CSS solutions, On a scale of one to five lightbulbs, how happy are you with the current state of CSS?, Webpack, Grunt, Gulp, Browserify, Bower, Other build tools, On a scale of one to five droplets, how happy are you with the current state of build tools?, Native Apps, React Native, Cordova, PhoneGap, NativeScript, Other mobile apps solutions, On a scale of one to five pencils, how happy are you with the current state of mobile apps?, Server-Side Rendering, Code Splitting, Optimistic Updates, Hot Module Reloading, Time-Travel Debugging, Real-Time Operations, Dead Code Elimination, Progressive Enhancement, Other Features, JavaScript is moving in the right direction, Building JavaScript apps is overly complex right now, JavaScript is over-used online, I enjoy building JavaScript apps, I would like JavaScript to be my main programming language, The JavaScript ecosystem is changing too fast, This survey is too damn long!, Years of Experience, Company Size, Yearly Salary, Favorite Text Editor, Other, Tabs or Spaces?, Other Comments, Start Date (UTC), Submit Date (UTC)]","[string, string, string, string, string, string, string, numeric, string, string, string, string, string, string, string, string, numeric, string, string, string, string, numeric, string, string, string, string, string, string, string, numeric, string, string, string, string, string, string, numeric, string, string, string, string, string, string, string, numeric, string, string, string, string, string, string, numeric, string, string, string, string, string, string, numeric, string, string, string, string, string, string, numeric, string, string, string, string, string, string, string, string, string, numeric, numeric, numeric, numeric, numeric, numeric, numeric, string, string, string, string, string, string, string, dateTime, dateTime]",Context Over nine thousand developers took part in the first edition of the State Of JavaScript survey. They answered questions on topics ranging from front-end frameworks and state management to build tools and testing libraries. You'll find out which libraries developers most want to learn next and which have the highest satisfaction ratings. And hopefully this data will help you make sense of the ever-changing JavaScript ecosystem. Content http//stateofjs.com/2016/introduction/ Acknowledgements Thanks to http//stateofjs.com/ open the data for download.,CSV,,"[programming languages, programming]",CC0,,,140,2718,20,Responses to the State of JavaScript survey,"The State of JavaScript, 2016",https://www.kaggle.com/integjs/state-of-javascript-2016,Mon Dec 05 2016
193,,SEPTA,[],[],SEPTA - Southeastern Pennsylvania Transportation Authority The SEPTA Regional Rail system consists of commuter rail service on 13 branches to more than 150 active stations in Philadelphia Pennsylvania and its suburbs and satellite cities.   SEPTA uses On-Time Performance (OTP)  to measure service reliability. OTP identifies the number of trains for all rail lines that arrive at their scheduled destination at the scheduled time.  However by industry standard  a train may arrive up to 5 minutes and 59 seconds after its scheduled time and still be considered on-time.   SEPTA has established an annual goal of 91% for Regional Rail On-Time Performance.  How well are they doing?  Is it even a meaningful measure? Data Description otp.csv  train_id direction ('N' or 'S'   direction is demarcated as either Northbound or Southbound)^1 origin (See map below - you'll see 'Warminster' 'Glenside'...'Airport Terminal..') next_station (Think of this as the station stop at timeStamp)  date status ('On Time' '5 min' '10 min'.  This is a status on train lateness. 999 is a suspended train) timeStamp   trainView.csv - GPS Train data (early release) Most GPS coordinates are based on track telemetry; however cars are being equipped with GPS units.   train_id status next_station service dest lon lat source track_change track date timeStamp0   First timeStamp at coordinates. timeStamp1    Last timeStamp at coordinates.  You can look at the example here on how to track a single train. What To Look For... Ah as a commuter you care more about the performance of the train(s) you plan to take.  OTP maybe 91% or above; but if the train you take runs late you'll spend extra time on the tracks.  If it consistently runs late maybe the schedule should be changed. Look for patterns. For example during the Tuesday morning rush do some trains run consistently late?   How long does it take to get to from point A to point B in the system?  Performance is VERY important to SEPTA.   Below is a map of the system and station stops.  This dataset contains data on the Regional Rail Lines.  SEPTA train schedules can be found here.  Note different Weekday Saturday and Sunday schedules.   ,CSV,,[rail transport],CC0,,,1803,25078,775,Predict  Arrival Times of Philadelphia's Regional Trains.,SEPTA - Regional Rail,https://www.kaggle.com/septa/on-time-performance,Sun Nov 06 2016
194,,zjf,"[id, huml, humw, ulnal, ulnaw, feml, femw, tibl, tibw, tarl, tarw, type]","[numeric, numeric, numeric, numeric, numeric, numeric, numeric, numeric, numeric, numeric, numeric, string]",Context There are many kinds of birds pigeons ducks ostriches penguins... Some are good at flying others can't fly but run fast. Some swim under water others wading in shallow pool.  According to their living environments and living habits birds are classified into different ecological groups. There are 8 ecological groups of birds  Swimming Birds Wading Birds Terrestrial Birds Raptors Scansorial Birds Singing Birds Cursorial Birds (not included in dataset) Marine Birds (not included in dataset)  First 6 groups are main and are covered by this dataset. Apparently birds belong to different ecological groups have different appearances flying birds have strong wings and wading birds have long legs. Their living habits are somewhat reflected in their bones' shapes. As data scientists we may think of examining the underlying relationship between sizes of bones and ecological groups  and recognising birds' ecological groups by their bones' shapes. Content There are 420 birds contained in this dataset. Each bird is represented by 10 measurements (features)  Length and Diameter of Humerus Length and Diameter of Ulna Length and Diameter of Femur Length and Diameter of Tibiotarsus Length and Diameter of Tarsometatarsus   All measurements are continuous float numbers (mm) with missing values represented by empty strings. The skeletons of this dataset are collections of Natural History Museum of Los Angeles County. They belong to 21 orders 153 genera 245 species. Each bird has a label for its ecological group  SW Swimming Birds W Wading Birds T Terrestrial Birds R Raptors P Scansorial Birds SO Singing Birds  Acknowledgements This dataset is provided by Dr. D. Liu of Beijing Museum of Natural History. Inspiration This dataset is a 420x10 size continuous values unbalanced multi-class dataset. What can be done include  Data Visualisation Statical Analysis Supervised Classification Unsupervised Clustering  License Please do not publish or cite this dataset in research papers or other public publications.,CSV,,"[biology, ecology]",Other,,,529,4567,0.0244140625,Measurements of bones and ecological groups of birds,Birds' Bones and Living Habits,https://www.kaggle.com/zhangjuefei/birds-bones-and-living-habits,Wed Jan 18 2017
