,Anonymised Labels ,Author,Column Name,Column Type,Description,File Type,Image Dimension,Keywords,License,No Columns,No Rows,Number of Downloads,Number of views,Size,Summary,Title,URL,Updated
267,,Project Jupyter,"[Time Started, Date Submitted, Status, How often do you use Jupyter Notebook?, What, if anything, hinders you from making Jupyter Notebook an even more regular part of your workflow?, Roughly how long have you been using Jupyter Notebook?, Tool / Application #1:What tools and applications, if any, would you like to see more tightly integrated with Jupyter Notebook?    , Tool / Application #2:What tools and applications, if any, would you like to see more tightly integrated with Jupyter Notebook?    , Tool / Application #3:What tools and applications, if any, would you like to see more tightly integrated with Jupyter Notebook?    , How do you run the Jupyter Notebook?, Other - Write In:How do you run the Jupyter Notebook?, Workflow Need #1:What needs in your workflow does Jupyter Notebook address?, Workflow Need #2:What needs in your workflow does Jupyter Notebook address?, Workflow Need #3:What needs in your workflow does Jupyter Notebook address?, Workflow Need #1:What needs in your workflow does Jupyter Notebook not address?, Workflow Need #2:What needs in your workflow does Jupyter Notebook not address?, Workflow Need #3:What needs in your workflow does Jupyter Notebook not address?, Aspect #1:What aspects of Jupyter Notebook make it pleasant to use in your workflow?, Aspect #2:What aspects of Jupyter Notebook make it pleasant to use in your workflow?, Aspect #3:What aspects of Jupyter Notebook make it pleasant to use in your workflow?, Aspect #1:What aspects of Jupyter Notebook make it difficult to use in your workflow?, Aspect #2:What aspects of Jupyter Notebook make it difficult to use in your workflow?, Aspect #3:What aspects of Jupyter Notebook make it difficult to use in your workflow?, Feature / Change #1:What new features or changes would you like to see in Jupyter Notebook? (Please list anything that comes to mind that helps you in your workflow, big or small.), Feature / Change #2:What new features or changes would you like to see in Jupyter Notebook? (Please list anything that comes to mind that helps you in your workflow, big or small.), Feature / Change #3:What new features or changes would you like to see in Jupyter Notebook? (Please list anything that comes to mind that helps you in your workflow, big or small.), Enhancement #1:Thinking back to when you first started using Jupyter Notebook, what enhancements would have made your initial experience better?, Enhancement #2:Thinking back to when you first started using Jupyter Notebook, what enhancements would have made your initial experience better?, Enhancement #3:Thinking back to when you first started using Jupyter Notebook, what enhancements would have made your initial experience better?, Select all the words that best describe Jupyter Notebook., Other word(s)::Select all the words that best describe Jupyter Notebook., What is your primary role when using Jupyter Notebook (e.g., student, astrophysicist, financial modeler, business manager, etc.)?, How many years have you been in this role? , Industry #1:What industries does your role and analytical work support (e.g., Journalism, IT, etc.)?, Industry #2:What industries does your role and analytical work support (e.g., Journalism, IT, etc.)?, Industry #3:What industries does your role and analytical work support (e.g., Journalism, IT, etc.)?, How many people typically see and/or interact with the results of your work in Jupyter Notebook? (Consider people who view your notebooks on nbviewer, colleagues who rerun your notebooks, developers who star your notebook repos on GitHub, audiences who se]","[dateTime, dateTime, string, string, string, string, string, string, string, string, string, string, string, string, string, string, string, string, string, string, string, string, string, string, string, string, string, string, string, string, string, string, string, string, string, string, string]",At the end of 2015 the Jupyter Project conducted a UX Survey for Jupyter Notebook users. This dataset Survey.csv contains the raw responses. See the Google Group Thread for more context around this dataset. ,CSV,,[human-computer interaction],CC4,,,813,12076,0.73046875,Understand user perspectives on Jupyter Notebooks,2015 Notebook UX Survey,https://www.kaggle.com/jupyter/2015-notebook-ux-survey,Mon May 01 2017
268,,Reddit,[],[],Recently Reddit released an enormous dataset containing all ~1.7 billion of their publicly available comments. The full dataset is an unwieldy 1+ terabyte uncompressed so we've decided to host a small portion of the comments here for Kagglers to explore. (You don't even need to leave your browser!) You can find all the comments from May 2015 on scripts for your natural language processing pleasure. What had redditors laughing bickering and NSFW-ing this spring? Who knows? Top visualizations may just end up on Reddit. Data Description The database has one table May2015 with the following fields  created_utc ups subreddit_id link_id name score_hidden author_flair_css_class author_flair_text subreddit id removal_reason gilded downs archived author score retrieved_on body distinguished edited controversiality parent_id ,Other,,"[linguistics, reddit, internet]",Other,,,4632,46213,0,Get personal with a dataset of comments from May 2015,May 2015 Reddit Comments,https://www.kaggle.com/reddit/reddit-comments-may-2015,Wed Aug 05 2015
269,,franky07724,[],[],Context ShapeQA is a simple dataset for Visual Question Answering where a machine learning program will take an image and a question as input and create a answer in yes or no as output. An introduction of Visual Question Answering could be found in the following blog.  https//medium.com/@franky07724_57962/deep-learning-and-visual-question-answering-c8c8093941bc Content ShapeQA is a supervised learning problem with four files in total two files as the training dataset and two files as the testing dataset. The training dataset consists of two files  shapeqa_dataset_train_image_v1.zip ~ 5000 images shapeqa_dataset_train_list_v1.csv ~ an excel file consists of 5000 records where each record has four fields index the name of the image file the question corresponding to the image the label ~ 1 as yes and 0 as no  The testing dataset consists of two files  shapeqa_dataset_test_image_v1.zip ~ 1000 images shapeqa_dataset_test_list_v1.csv ~ an excel file cosnsits of 1000 records where each record has four fileds  index the name of the image file the question corresponding to the image  the label ~ 1 as yes and 0 as no  Acknowledgements The dataset is inspired by two previous works.  Object Detection with Neural Networks — a simple tutorial using keras the blog ~ https//towardsdatascience.com/object-detection-with-neural-networks-a4e2c46b4491 the code ~ https//github.com/jrieke/shape-detection Cornell Natual Language Visual Reasoning  the web ~ http//lic.nlp.cornell.edu/nlvr/ the paper ~ http//alanesuhr.com/suhr2017.pdf  Inspiration  Will a simple multimodal deep learning model i.e. using CNN for image recognition using RNN for natural language processing and combing the results of these two models produce a good result? How to correctly capture the relations (e.g. left right above and below) explored in questions? ,CSV,,[],CC0,,,0,65,14,Dataset for visual question answering,ShapeQA Version 1.0,https://www.kaggle.com/franky07724/shapeqa-v10-for-visual-question-answering,Wed Feb 14 2018
270,,Canggih P Wibowo,"[Anime_ID, Genres]","[numeric, string]",Context Japanese animation which is known as anime has become internationally widespread nowadays. This dataset provides data on anime taken from Anime News Network.  Content This dataset consists of 4029 anime data in 5 files. All of the csv files use '|' delimiter.   - Anime Title (datatitle-all-share-new.csv)   - Anime Synopsis (datasynopsis-all-share-new.csv)   - Anime Genre (datagenre-all-share-new.csv)   - Anime Staff (datastaff-all-share-new.csv)   - Anime Scores (datascorehist-all-share-new.csv)  Anime ID and Staff were taken as what they seen on Anime News Network system. While the scores are taken based on the histogram of scores on each anime page and normalized. Acknowledgements The dataset was collected from http//www.animenewsnetwork.com on 10 May 2016. If you use this dataset in publications please cite  Wibowo C. P. (2016). A Minimum Spanning Tree Representation of Anime Similarities. arXiv preprint arXiv1606.03048  Inspiration This dataset can be used to build recommendation systems predict a score visualize anime similarity etc.,CSV,,"[popular culture, film, animation, entertainment]",CC4,,,9,181,2,Consists of 4029 anime data,"Anime Data (Score, Staff, Synopsis, and Genre)",https://www.kaggle.com/canggih/anime-data-score-staff-synopsis-and-genre,Thu Feb 22 2018
271,,Arizona Secretary of State,[],[],Context Complete statewide mapping files of a state's precincts can be difficult to come by. This file has been compiled to fill that need. Content This is the most recent statewide precinct file for Arizona. The properties have been generated for efficiently slicing and dicing up counties so that the file can be merged with Legislative and Congressional districts as well as other political boundaries. Acknowledgements The precinct file is recompiled using data requested from one of Arizona's 15 county GIS departments whenever a county re-precincts. Inspiration Gain insight into Arizona's political demographics by combining this with election results files census tracts and other publicly available geographic information.,{}JSON,,[],CC0,,,2,31,0.35546875,JSON map file of all of Arizona's 1495 Voting Tabulation Districts,Map of Arizona Voting Precincts,https://www.kaggle.com/azsecretaryofstate/arizona-voting-precincts,Fri Feb 23 2018
272,,Canggih P Wibowo,"[Title, Subtitle, Owner, Votes, Versions, Tags, Data Type, Size, License, Views, Download, Kernels, Topics, URL, Description]","[string, string, string, numeric, string, string, string, string, string, string, string, string, string, string, string]",Context Kaggle dataset becomes a popular growing place to share datasets. Almost every day there will be new datasets uploaded. I am curious to explore what can be extracted from the information of each dataset. Content This dataset consists 2150 datasets information in 15 columns  Title Subtitle Owner Vote Version History Tags Datatype Size License Views Downloads Kernels Topics URL Description  Acknowledgements All data were taken from Kaggle website. Collected on 26 Feb 2018 Inspiration With this dataset we may try to predict the upcoming datasets uploaded including its topics number of votes number of downloads etc. Data visualization involving clustering may be performed also.,CSV,,"[databases, information]",CC0,,,10,235,1,2885 Kaggle datasets with at least one vote,Upvoted Kaggle Dataset,https://www.kaggle.com/canggih/voted-kaggle-dataset,Thu Feb 22 2018
273,,Nick Brooks,[jigaboo],[string],Context The purpose of this dataset is to support the Toxic Comment Classification Competition. The goal is to help Jigsaw create a model detecting language toxicity levels. Building of the this dataset is available on my Github. Content This dataset contains a lot of bad words. Acknowledgements Carnegie Mellon University user2592414 on StackExchange Inspiration Use this for good.,CSV,,"[languages, crime, linguistics, internet]",CC0,,,41,251,0.0126953125,1617 Unique Bad Words,Bad Bad Words,https://www.kaggle.com/nicapotato/bad-bad-words,Thu Feb 22 2018
274,,Karan,[],[],Context There's a story behind every dataset and here's your opportunity to share yours. IMDB work done during office hours.  Content What's inside is more than just rows and columns. Make it easy for others to get started by describing how you acquired the data and what time period it represents too. IMDB review dataset.  Acknowledgements We wouldn't be here without the help of others. If you owe any attributions or thanks include them here along with any citations of past research. Inspiration Your data will be in front of the world's largest data science community. What questions do you want to see answered?,Other,,[],CC0,,,2,13,0.447265625,IMDb Analytics using python,IMDB office,https://www.kaggle.com/karan1990/imdb-office,Thu Feb 22 2018
275,,kail,"[id, toxic, severe_toxic, obscene, threat, insult, identity_hate]","[string, numeric, numeric, numeric, numeric, numeric, numeric]",This dataset does not have a description yet.,CSV,,[],Other,,,1,9,10, ,best_gru_submmision,https://www.kaggle.com/kagglelzj/best-gru-submmision,Fri Feb 23 2018
276,,TerenceLiu,[],[],This dataset does not have a description yet.,Other,,[],CC0,,,127,309,131, ,glove.6B.100d.txt,https://www.kaggle.com/terenceliu4444/glove6b100dtxt,Sat Jan 13 2018
277,,piupiu,"[the, ðə; ði, art. 这；那,adv. 更加（用于比较级，最高级前）]","[string, string, string]",This dataset does not have a description yet.,CSV,,[],CC0,,,23,14,1, ,dictcn,https://www.kaggle.com/pureheart/dictcn,Fri Feb 23 2018
278,,Gonzalo Barrientos,[],[],This dataset does not have a description yet.,Other,,[],CC0,,,74,47,259, ,glove6b-200d,https://www.kaggle.com/gonzalo90/glove6b200d,Wed Feb 14 2018
279,,Pat P,"[year, round, pick, player, position, school]","[numeric, numeric, numeric, string, string, string]",Context Created for March Madness competition. To be used as a measure of talent on each team. Content Self-explanatory Acknowledgements Pulled from wikipedia using BeautifulSoup 2018 mock from http//www.nbadraft.net/2018mock_draft,Other,,[],CC0,,,19,58,0.08203125, ,NBA Draft 1980-2017,https://www.kaggle.com/pmp5kh/nba-draft-19802017,Fri Feb 23 2018
280,,Ashish Gupta,[],[],Context Consist 28x28 handwritten Alphabet images Content There are total 785 columns each row consists an image of alphabets. The first coloumn represents the alphabet numbering from 0-25 as A-Z.,CSV,,"[cnn, image data]",CC0,,,33,188,92,MNIST like dataset for alphabets(A-Z),Handwritten A-Z ,https://www.kaggle.com/ashishguptajiit/handwritten-az,Fri Jan 26 2018
281,,Tigan2,"[school;sex;age;address;famsize;Pstatus;Medu;Fedu;Mjob;Fjob;reason;guardian;traveltime;studytime;failures;schoolsup;famsup;paid;activities;nursery;higher;internet;romantic;famrel;freetime;goout;Dalc;Walc;health;absences;G1;G2;G3, sex, age, address, famsize, Pstatus, Medu, Fedu, Mjob, Fjob, reason, guardian, traveltime, studytime, failures, schoolsup, famsup, paid, activities, nursery, higher, internet, romantic, famrel, freetime, goout, Dalc, Walc, health, absences, G1, G2, G3]","[string, string, numeric, string, string, string, numeric, numeric, string, string, string, string, numeric, numeric, numeric, string, string, string, string, string, string, string, string, numeric, numeric, numeric, numeric, numeric, numeric, numeric, numeric, numeric, numeric]",This dataset does not have a description yet.,CSV,,[],CC0,,,5,23,0.0400390625, ,students-dataset,https://www.kaggle.com/lopata/studentsdataset,Wed Feb 21 2018
282,,NagenderReddy,"[Film, Genre, Rotten Tomatoes Ratings %, Audience Ratings %, Budget (million $), Year of release]","[string, string, numeric, numeric, numeric, numeric]",This dataset does not have a description yet.,CSV,,[],GPL,,,1,11,0.0205078125, ,Movie Ratings,https://www.kaggle.com/nagenderp/movie-ratings,Thu Feb 22 2018
283,,Bletchley Bootcamp,"[Weekly_Sales, id]","[numeric, string]",Context This dataset originally stems from a Walmart recruiting challenge. It is used here for educational purposes only. Content The dataset contains anonymized sales by department for 45 Walmart stores as well as supporting features. Acknowledgements The dataset belongs to Walmart and is used here only for educational purposes Inspiration Try to predict weekly sales.,CSV,,[],Other,,,56,368,14,A processed version of an old recruitment challenge,Course Material: Walmart Challenge,https://www.kaggle.com/bletchley/course-material-walmart-challenge,Fri Feb 02 2018
284,,Kyle,"[User_ID, Product_ID, Gender, Age, Occupation, City_Category, Stay_In_Current_City_Years, Product_Category_1, Product_Category_2, Product_Category_3, Marital_Status, Female, Male, Age_0-17, Age_18-25, Age_26-35, Age_36-45, Age_46-50, Age_51-55, Age_55+, 0_Occupation, 1_Occupation, 2_Occupation, 3_Occupation, 4_Occupation, 5_Occupation, 6_Occupation, 7_Occupation, 8_Occupation, 9_Occupation, 10_Occupation, 11_Occupation, 12_Occupation, 13_Occupation, 14_Occupation, 15_Occupation, 16_Occupation, 17_Occupation, 18_Occupation, 19_Occupation, 20_Occupation, City_Category_A, City_Category_B, City_Category_C, Stay_0yr, Stay_1yr, Stay_2yr, Stay_3yr, Stay4+yr, 1_Product_Category, 2_Product_Category, 3_Product_Category, 4_Product_Category, 5_Product_Category, 6_Product_Category, 7_Product_Category, 8_Product_Category, 9_Product_Category, 10_Product_Category, 11_Product_Category, 12_Product_Category, 13_Product_Category, 14_Product_Category, 15_Product_Category, 16_Product_Category, 17_Product_Category, 18_Product_Category, 19_Product_Category, 20_Product_Category, AgeNew_0-17_55+, AgeNew_26-35, AgeNew_18-25_36_45, AgeNew_51+, OccupationNew_0-2, OccupationNew_3-5, OccupationNew_6-8, OccupationNew_9-11, OccupationNew_12-14, OccupationNew_15-17, OccupationNew_18-20, Unqiue_Cat_Count, 2-3_Cat_Count, 4-5_Cat_Count, 6+_Cat_Count, AvgPurchaseAmount, NumberPurchasesUser]","[numeric, string, string, string, numeric, string, string, numeric, numeric, numeric, numeric, numeric, numeric, numeric, numeric, numeric, numeric, numeric, numeric, numeric, numeric, numeric, numeric, numeric, numeric, numeric, numeric, numeric, numeric, numeric, numeric, numeric, numeric, numeric, numeric, numeric, numeric, numeric, numeric, numeric, numeric, numeric, numeric, numeric, numeric, numeric, numeric, numeric, numeric, numeric, numeric, numeric, numeric, numeric, numeric, numeric, numeric, numeric, numeric, numeric, numeric, numeric, numeric, numeric, numeric, numeric, numeric, numeric, numeric, numeric, numeric, numeric, numeric, numeric, numeric, numeric, numeric, numeric, numeric, numeric, numeric, numeric, numeric, numeric, numeric, numeric]",This dataset does not have a description yet.,CSV,,[],Other,,,1,14,15, ,Black Friday Big,https://www.kaggle.com/bostonian92/black-friday-big,Thu Feb 22 2018
285,,Leonardo Ferreira ,"[, Age, Sex, Job, Housing, Saving accounts, Checking account, Credit amount, Duration, Purpose, Risk]","[numeric, numeric, string, numeric, string, string, string, numeric, numeric, string, string]",This dataset does not have a description yet.,CSV,,[],CC0,,,80,161,0.05078125, ,german_credit_data_with_risk,https://www.kaggle.com/kabure/german-credit-data-with-risk,Tue Jan 09 2018
286,,Aperonofsorts,[],[],This dataset does not have a description yet.,Other,,[],Other,,,1,8,0.0224609375, ,DATA DICTIONARY,https://www.kaggle.com/jonchan2003/data-dictionary,Thu Feb 22 2018
287,,Zhe Song,"[sale_date, class_id, sale_quantity, brand_id, compartment, type_id, level_id, department_id, TR, gearbox_type, displacement, if_charging, price_level, price, driven_type_id, fuel_type_id, newenergy_type_id, emission_standards_id, if_MPV_id, if_luxurious_id, power, cylinder_number, engine_torque, car_length, car_width, car_height, total_quality, equipment_quality, rated_passenger, wheelbase, front_track, rear_track]","[numeric, numeric, numeric, numeric, numeric, numeric, numeric, numeric, numeric, string, numeric, string, string, numeric, numeric, numeric, numeric, numeric, numeric, numeric, numeric, numeric, numeric, numeric, numeric, numeric, numeric, numeric, numeric, numeric, numeric, numeric]",This dataset does not have a description yet.,CSV,,[business],CC0,,,4,38,0.3642578125,Dataset for Yancheng City Big Data Competition 2018,Car Sales of Yancheng City,https://www.kaggle.com/zhesong1/yanchengcarsales,Thu Feb 22 2018
288,,Krishna Tej,"[PassengerId, Survived]","[numeric, numeric]",This dataset does not have a description yet.,CSV,,[],CC0,,,1,10,0.0888671875, ,"Train, Test and Gender",https://www.kaggle.com/krishnatejat/train-test-and-gender,Wed Feb 21 2018
289,,Manoj Chitteti,[],[],This dataset does not have a description yet.,CSV,,[],Other,,,2,14,0.541015625, ,movie-metadata,https://www.kaggle.com/manojchitteti/moviemetadata,Thu Feb 22 2018
290,,KK16,[],[],Context Introduction The dataset used for this experiment is real and authentic. The dataset is acquired from UCI machine learning repository website [13]. The title of the dataset is ‘Crime and Communities’. It is prepared using real data from socio-economic data from 1990 US Census law enforcement data from the 1990 US LEMAS survey and crimedata from the 1995 FBI UCR [13]. This dataset contains a total number of 147 attributes and 2216 instances. The per capita crimes variables were calculated using population values included in the 1995 FBI data (which differ from the 1990 Census values).  Content The variables included in the dataset involve the community such as the percent of the population considered urban and the median family income and involving law enforcement such as per capita number of police officers and percent of officers assigned to drug units. The crime attributes (N=18) that could be predicted are the 8 crimes considered 'Index Crimes' by the FBI)(Murders Rape Robbery .... ) per capita (actually per 100000 population) versions of each and Per Capita Violent Crimes and Per Capita Nonviolent Crimes) predictive variables  125 non-predictive variables  4 potential goal/response variables  18 Acknowledgements http//archive.ics.uci.edu/ml/datasets/Communities%20and%20Crime%20Unnormalized U. S. Department of Commerce Bureau of the Census Census Of Population And Housing 1990 United States Summary Tape File 1a & 3a (Computer Files) U.S. Department Of Commerce Bureau Of The Census Producer Washington DC and Inter-university Consortium for Political and Social Research Ann Arbor Michigan. (1992) U.S. Department of Justice Bureau of Justice Statistics Law Enforcement Management And Administrative Statistics (Computer File) U.S. Department Of Commerce Bureau Of The Census Producer Washington DC and Inter-university Consortium for Political and Social Research Ann Arbor Michigan. (1992) U.S. Department of Justice Federal Bureau of Investigation Crime in the United States (Computer File) (1995) Inspiration Your data will be in front of the world's largest data science community. What questions do you want to see answered? Data available in the dataset  may not act as a complete source of information for identifying factors that contribute to more violent and non-violent crimes as many relevant factors may still be missing. However I would like to try and answer the following questions answered.  Analyze if number of vacant and occupied houses and the period of time the houses were vacant had contributed to any significant change in violent and non-violent crime rates in communities How has unemployment changed crime rate(violent and non-violent) in the communities? Were people from a particular age group more vulnerable to crime? Does ethnicity play a role in crime rate? Has education played a role in bringing down the crime rate? ,{}JSON,,[],CC4,,,20,136,0.6650390625, ,UCI Communities and Crime Unnormalized Data Set,https://www.kaggle.com/kkanda/communities and crime unnormalized data set,Wed Feb 21 2018
291,,bigdatarecommendation,[],[],This dataset does not have a description yet.,Other,,[],CC0,,,11,97,1024, ,YouTube_popular,https://www.kaggle.com/maxrmit/youtube-popular,Fri Feb 23 2018
292,,Ruta Sakalauskaite,"[id, toxic, severe_toxic, obscene, threat, insult, identity_hate]","[string, numeric, numeric, numeric, numeric, numeric, numeric]",This dataset does not have a description yet.,CSV,,[],Other,,,3,18,26, ,submission-ensemble-NN-LG,https://www.kaggle.com/goomba16/submissionensemblennlg,Thu Feb 22 2018
293,,Alexander Kireev,"[id, toxic, severe_toxic, obscene, threat, insult, identity_hate]","[string, numeric, numeric, numeric, numeric, numeric, numeric]",This dataset does not have a description yet.,CSV,,[],Other,,,1,8,10, ,sub_Vl,https://www.kaggle.com/alexanderkireev/sub-vl,Thu Feb 22 2018
294,,Aswin Ash,"[V1, V2, V3, V4, V5, Class]","[numeric, numeric, numeric, numeric, numeric, numeric]",This dataset does not have a description yet.,CSV,,[],CC0,,,3,12,0.00390625, ,newdata,https://www.kaggle.com/aswinps22/newdata,Sat Feb 17 2018
295,,Victor Paslay,"[id, target]","[numeric, numeric]",This dataset does not have a description yet.,CSV,,[],CC0,,,2009,411,89, ,kaggle-porto-seguro-submissions,https://www.kaggle.com/vpaslay/kaggleportosegurosubmissions,Sun Nov 12 2017
296,,SHAIK RESHMA,"[ID, Gender, Age, City_Code, City_Category, Employer_Code, Employer_Category1, Employer_Category2, Monthly_Income, Customer_Existing_Primary_Bank_Code, Primary_Bank_Type, Contacted, Source, Source_Category, Existing_EMI, Loan_Amount, Loan_Period, Interest_Rate, EMI, Var1]","[string, string, numeric, string, string, string, string, numeric, numeric, string, string, string, string, string, numeric, string, string, string, string, numeric]",This dataset does not have a description yet.,CSV,,[],CC0,,,2,20,2, ,LOAN PREDICTION,https://www.kaggle.com/shaikreshma/loan-prediction,Wed Feb 21 2018
297,,Jokingpoet,[],[],This dataset does not have a description yet.,Other,,[],CC0,,,2,15,0.9658203125, ,arrhythmia,https://www.kaggle.com/jokingpoet/arrhythmia,Tue Feb 20 2018
298,,areeves87,"[id, target]","[numeric, numeric]",This dataset does not have a description yet.,CSV,,[],CC0,,,734,114,367, ,Output for 20 kernels porto seguro,https://www.kaggle.com/areeves87/kernel-census,Tue Nov 07 2017
