,Anonymised Labels ,Author,Column Name,Column Type,Description,File Type,Image Dimension,Keywords,License,No Columns,No Rows,Number of Downloads,Number of views,Size,Summary,Title,URL,Updated
90,,NASA,"[name, id, nametype, recclass, mass, fall, year, reclat, reclong, GeoLocation]","[string, numeric, string, string, numeric, string, numeric, numeric, numeric, string]","The Meteoritical Society collects data on meteorites that have fallen to Earth from outer space. This dataset includes the location mass composition and fall year for over 45000 meteorites that have struck our planet. Notes on missing or incorrect data points   a few entries here contain date information that was incorrectly parsed into the NASA database. As a spot check any date that is before 860 CE or after 2016 are incorrect; these should actually be BCE years. There may be other errors and we are looking for a way to identify them. a few entries have latitude and longitude of 0N/0E (off the western coast of Africa where it would be quite difficult to recover meteorites). Many of these were actually discovered in Antarctica but exact coordinates were not given. 0N/0E locations should probably be treated as NA.  The starter kernel for this dataset has a quick way to filter out these observations using dplyr in R provided here for convenience meteorites.geo <- meteorites.all %>%    filter(year>=860 & year<=2016) %>%  # filter out weird years    filter(reclong<=180 & reclong>=-180 & (reclat!=0 | reclong!=0))  # filter out weird locations   The Data Note that a few column names start with ""rec"" (e.g. recclass reclat reclon). These are the recommended values of these variables according to The Meteoritical Society. In some cases there were historical reclassification of a meteorite or small changes in the data on where it was recovered; this dataset gives the currently recommended values. The dataset contains the following variables    name the name of the meteorite (typically a location often modified with a number year composition etc) id a unique identifier for the meteorite  nametype one of  -- valid a typical meteorite  -- relict a meteorite that has been highly degraded by weather on Earth   recclass the class of the meteorite; one of a large number of classes based on physical chemical and other characteristics (see the Wikipedia article on meteorite classification for a primer) mass the mass of the meteorite in grams fall whether the meteorite was seen falling or was discovered after its impact; one of  -- Fell the meteorite's fall was observed  -- Found the meteorite's fall was not observed   year the year the meteorite fell or the year it was found (depending on the value of fell) reclat the latitude of the meteorite's landing reclong the longitude of the meteorite's landing GeoLocation a parentheses-enclose comma-separated tuple that combines reclat and reclong  What can we do with this data? Here are a couple of thoughts on questions to ask and ways to look at this data  how does the geographical distribution of observed falls differ from that of found meteorites? -- this would be great overlaid on a cartogram or alongside a high-resolution population density map are there any geographical differences or differences over time in the class of meteorites that have fallen to Earth?  Acknowledgements This dataset was downloaded from NASA's Data Portal and is based on The Meteoritical Society's Meteoritical Bulletin Database (this latter database provides additional information such as meteorite images links to primary sources etc.).",CSV,,"[astronomy, space]",CC0,,,2227,18222,4,Data on over 45k meteorites that have struck Earth,Meteorite Landings,https://www.kaggle.com/nasa/meteorite-landings,Sat Nov 05 2016
91,,Stack Overflow,"[Id, OwnerUserId, CreationDate, ParentId, Score, Body]","[numeric, numeric, dateTime, numeric, numeric, string]",Dataset with the text of 10% of questions and answers from the Stack Overflow programming Q&A website. This is organized as three tables  Questions contains the title body creation date closed date (if applicable) score and owner ID for all non-deleted Stack Overflow questions whose Id is a multiple of 10. Answers contains the body creation date score and owner ID for each of the answers to these questions. The ParentId column links back to the Questions table. Tags contains the tags on each of these questions  Datasets of all R questions and all Python questions are also available on Kaggle but this dataset is especially useful for analyses that span many languages. Example projects include  Identifying tags from question text Predicting whether questions will be upvoted downvoted or closed based on their text Predicting how long questions will take to answer  License All Stack Overflow user contributions are licensed under CC-BY-SA 3.0 with attribution required.,CSV,,"[internet, programming languages]",Other,,,1152,10310,3072,Text from 10% of Stack Overflow questions and answers on programming topics,StackSample: 10% of Stack Overflow Q&A,https://www.kaggle.com/stackoverflow/stacksample,Fri Oct 21 2016
92,,LiamLarsen,"[id, created_at, text]","[numeric, dateTime, string]",Content  tweet id contains tweet-stamp date + time date and time of day (24hr) tweet text text of tweet remove 'b'  usage What's someone going to do with a bunch of tweets?  Maybe someone would want to generate text using this dataset or do sentiment analysis Or find out the most likely time of day Elon would tweet. pie his tweets per month ITS DATA!!  Either way its up to you! Inspiration ,CSV,,"[celebrity, technology forecasting, internet]",Other,,,207,2737,0.3837890625,All Elon Musk Tweets from 2010 to 2017,"Elon Musk Tweets, 2010 to 2017",https://www.kaggle.com/kingburrito666/elon-musk-tweets,Sun Apr 23 2017
93,,dgoke1,"[Y, filename, sex, age, age_years, corpus, group, child_TNW, child_TNS, examiner_TNW, freq_ttr, r_2_i_verbs, mor_words, num_pos_tags, n_dos, repetition, retracing, fillers, s_1g_ppl, s_2g_ppl, s_3g_ppl, d_1g_ppl, d_2g_ppl, d_3g_ppl, z_mlu_sli, z_mlu_td, z_word_errors_sli, z_word_errors_td, z_r_2_i_verbs_sli, z_r_2_i_verbs_td, z_utts_sli, z_utts_td, total_syl, average_syl, mlu_words, mlu_morphemes, mlu100_utts, verb_utt, dss, ipsyn_total, present_progressive, propositions_in, propositions_on, plural_s, irregular_past_tense, possessive_s, uncontractible_copula, articles, regular_past_ed, regular_3rd_person_s, irregular_3rd_person, uncontractible_aux, contractible_copula, contractible_aux, word_errors, f_k, n_v, n_aux, n_3s_v, det_n_pl, det_pl_n, pro_aux, pro_3s_v, total_error]","[numeric, string, string, numeric, numeric, string, string, numeric, numeric, numeric, numeric, numeric, numeric, numeric, numeric, numeric, numeric, numeric, numeric, numeric, numeric, numeric, numeric, numeric, numeric, numeric, numeric, numeric, numeric, numeric, numeric, numeric, numeric, numeric, numeric, numeric, numeric, numeric, numeric, numeric, numeric, numeric, numeric, numeric, numeric, numeric, numeric, numeric, numeric, numeric, numeric, numeric, numeric, numeric, numeric, numeric, numeric, numeric, numeric, numeric, numeric, numeric, numeric, numeric]",Context Specific Language Impairment  is a condition that effects roughly 7% of 5-year old children. It is characterised by a lack of language ability in comparison to your peers but with no obvious mental or physical disability. Diagnosis can tend to be laborious thus automating this process using NLP and ML techniques might be of interest to paediatricians and speech pathologists.  Content This study evaluated three datasets obtained via the CHILDES project. All the datasets consist of narratives from a child attempting to complete a wordless picture task. The choice to use only narrative corpora was based on previous research which indicated it has the best ability to distinguish a language impairment in children. The first dataset consists of samples from British adolescents the second from Canadian children aged 4 to 9 and the third from U.S. children aged 4 to 12.  Unfortunately finding transcript data of this kind is rare I have tried to find more data to no avail so 1163 samples will have to do. Conti-Ramsden 4 The Conti-Ramsden 4 dataset was collected for a study to assess the effectiveness of narrative tests on adolescents. It consists of 99 TD and 19 SLI samples of children between the ages of 13.10 and 15.90. Ideally all the corpora would only be from children as SLI is most prominent in children aged five years old and is best detected early. However it was included to enable a direct comparison between classifiers created by Gabani and this study. The corpus contains transcripts of a story telling task based on Mayer’s wordless picture book “Frog Where Are You”. The children first viewed the picture book in their own time before being prompted to retell the story in the past tense. If the children started telling the story in the present tense the interviewer would prompt them with the phrase “What happened next?” in order to attempt to revert them back to the past tense. If they failed to start to retell the story in the past tense after two prompts no further prompts were made. ENNI The ENNI dataset was collected during the course of a study aimed at identifying SLI children using an index of storytelling ability based on the story grammar model. The corpus consists of 300 TD and 77 SLI samples of children aged between 4 and 9 years old. Each child was presented with two wordless picture stories with one more complicated than the other. Unlike Conti-Ramsden 4 the examiner held the book and turned the page after the child appeared to be finished telling the story for a particular picture. The children were also given the opportunity to practice on a training story where the examiner gave more explicit prompts to the child about what to do. Gillam The Gillam dataset is based on another tool for narrative assessment known as “The Test of Narrative Language (TNL). It consists of 250 language impaired children and 520 controls aged between 5 and 12. A detailed description of each of the participants does not exist. The TNL consists of four storytelling tasks the first is a recall of a script based story the rest being wordless picture books. The first picture set depicts a story with a main protagonist having repeated attempts at the goal and the rest are single picture stories. The single picture stories require more input from the child and thus is better suited to older children. The TNL appears to be intermediary in difficulty compared to ENNI. Features Attribute | Name | Description   Y                         | The label  | 0 for typically developing children 1 for language impaired  child_TNW         | Total Number of Words | The total number of words in the transcript  child_TNS          | Total Number of Sentences | Children with SLI are more likely to speak in short sentences  group                 | Same as Y | BEWARE Is the same as Y but easier to graph in Python and R  examiner_TNW | Total Number of Words spoken by the examiner | Children with SLI are more likely to need support  freq_ttr                     | Frequency of Word Types to Word Token Ratio | Divides word types by word tokens and provides a rough measure of lexical diversity.  r_2_i_verbs| Ratio of raw to inflected verbs | Children with SLI often have difficulty with the morphemes -ed -s be and do. This results in the use of raw verbs instead of their inflected forms.  mor_words | Number of words in the %mor tier |  num_pos_tags | Number of different Part-of-Speech tags |  n_dos | Number of Do's | The number of time the word 'do' is used  repetition | Number of Repetitions  | Counts the number of repetitions as tagged in the CHAT format inside square brackets e.g. milk milk milk milk = milk [x 4]  retracing | Number of Retracings | A retracing is defined as when a speaker abandons an utterance but then continues again.  fillers | Number of Fillers | Counts the number of fillers used in total. A list of fillers was created by searching through the entire corpus (all 1038 samples) for all common variants of fillers such as um umm uh uhh etc.  s_1g_ppl | Perplexity of 1-gram SLI | The perplexity of this sample in comparison to a language model trained on all the SLI group for this corpora except the sample  s_2g_ppl | Perplexity of 2-gram SLI | Same as above but with a 2-gram LM  s_3g_ppl | Perplexity of 3-gram SLI | Same as above but with a 3-gram LM  d_1g_ppl | Perplexity of 1-gram TD | The perplexity of this sample in comparison to a language model trained on all the TD group for this corpora except the sample  d_2g_ppl | Perplexity of 2-gram TD | Same as above but with a 2-gram LM  d_3g_ppl | Perplexity of 3-gram TD | Same as above but with a 3-gram LM  z_mlu_sli | Sample Z-score using SLI group's Mean Length of Utterance |  z_mlu_td | Sample Z-score using TD group's Mean Length of Utterance |  z_ndw_sli | Sample Z-score using SLI group's RawInflected Verbs Ratio  |  z_ndw_td | Sample Z-score using TD group's RawInflected Verbs Ratio |  z_ipsyn_sli | Sample Z-score using SLI group's Developmental Sentence Score |  z_ipsyn_td | Sample Z-score using TD group's Developmental Sentence Score |  z_utts_sli |Sample Z-score using SLI group's Number of Verb Utterances |  z_utts_td |Sample Z-score using TD group's Number of Verb Utterances |  total_syl |  Total number of Syllables | Using a technique from  average_syl | Average number of Syllables per word |  mlu_words | Mean Length of Utterance of Words  |  mlu_morphemes |  Mean Length of Utterance of Morphemes |  mlu100_utts | Mean Length of Utterance of 1st 100 words  |  verb_utt | Number of verb utterances |  dss | Developmental Sentence Score |  ipsyn_total | Index of Productive Syntax Score |   The following fields are counts of instances of Brown's Stages of Morphological Development (see https//www.speech-language-therapy.com/index.php?option=com_content&view=article&id=33brown&catid=2uncategorised&Itemid=117)    present_progressive  propositions_in  propositions_on  plural_s  irregular_past_tense  possessive_s  uncontractible_copula  articles  regular_past_ed  regular_3rd_person_s  irregular_3rd_person  uncontractible_aux  contractible_copula  contractible_aux  Back to normal      word_errors |  Number of Word Errors | As marked in the transcripts  f_k | Flesch-Kincaid Score | See https//en.wikipedia.org/wiki/Flesch%E2%80%93Kincaid_readability_tests  n_v | Number of Nouns followed immediately by a verb  n_aux | Number of Nouns followed immediately by an Auxillary verb  n_3s_v | Number of Third Singular Nouns followed immediately by a verb  det_n_pl | * Number of Determinant Nouns followed by a Personal Pronoun*  det_pl_n | * Number of Determinant Pronouns followed by a Noun  pro_aux | * Pronouns followed by Auxillary Verb*  pro_3s_v | * 3rd. singular nominative pronoun followed by Verb*  total_error | Total number of morphosyntactic errors | Sum of the columns from nouns verbs down       This table will take some time to finish will get to it within a few days Past Research I have spent the last few months playing around with this data I have uploaded it here mainly to speed up the computation of the analysis I have already done. But I'm excited to see what other people can do with this. There are some nice graphs to be made; especially using the MLU attributes. Thus far using the combined corpora the best I have managed to get in terms of creating a predictive classifier is using Neural Networks with Feature Extraction and SMOTE to get a mean ROC of 0.8709 under 10-repeated-10-k-folds CV. You'll find that Random Forest and SVM with an RBF kernel do comparably well with SMOTE. Acknowledgements All the data here was derived by me using the open source transcripts provided on the CHILDES Talkbank (http//childes.talkbank.org/). The methods I used are very close to those in  K. Gabani T. Solorio Y. Liu K.-n. Hassanali and C. A. Dollaghan “Exploring a corpus-based approach for detecting language impairment in monolingual english-speaking children” Artificial Intelligence in Medicine vol. 53 no. 3 pp. 161–170 2011. Conti-4 D. Wetherell N. Botting and G. Conti-Ramsden “Narrative skills in adolescents with a history of SLI in relation to non-verbal IQ scores” Child Language Teaching and Therapy vol. 23 no. 1 pp. 95–113 2007. ENNI P. Schneider D. Hayward and R. V. Dub “Storytelling from pictures using the Edmonton Narrative Norms Instrument” 2006. Gillam R. Gillam and N. Pearson Test of Narrative Language. Austin TX Pro-Ed Inc. 2004. Inspiration I'm hoping somebody can beat my score. I'm keen to learn more and see if this can become anything that might be of use to some child/family someday.,CSV,,"[healthcare, children, linguistics]",CC0,,,343,3959,0.603515625,Explore and create models using data derived from transcripts in CHILDES,Diagnose Specific Language Impairment in Children,https://www.kaggle.com/dgokeeffe/specific-language-impairment,Thu Nov 23 2017
94,,AdhokshajaPradeep,"[, text, favorited, favoriteCount, replyToSN, created, truncated, replyToSID, id, replyToUID, statusSource, screenName, retweetCount, isRetweet, retweeted, longitude, latitude]","[numeric, string, boolean, numeric, string, dateTime, boolean, numeric, numeric, numeric, string, string, numeric, boolean, boolean, string, string]","The Presidency of Donald Trump On Jan 20th 2017 Donald J. Trump was elected as the 45th President of the United States. This marked the end of a brutal and contentious campaign. He goes in as one of the most unpopular presidents in modern history(based on the popular vote).  The Inauguration and the Women's March Trump's election to the presidency led to the organization of the Women's March  where millions of men and women took to the streets to protest the new government's stance on women's rights and healthcare. Social media blew up with searchable terms like ""#WomensMarch"" prompting major news organizations to cover the mass protests.  Data Acquisition The data was acquired using the twitteR package's searchTwitter() function. This function makes a call to the Twitter API. A total of 30000 tweets containing #Inauguration and #WomensMarch were obtained (15000 for each). Data Set Attributes 1 ""X""  Serial Number     2 ""text""   Tweet Text         3 ""favorited""  TRUE/FALSE    4 ""favoriteCount""  Number of Likes 5  ""replyToSN""  Screen Handle name of the receiver 6  ""created""  YYYY-MM-DD HMS 7 ""truncated""  If the Tweet is Truncated (TRUE/FALSE) 8 ""replyToSID"" ID of the receiver  9  ""id""  ID          10 ""replyToUID"" User ID of the receiver     11 ""statusSource"" Device Information (Web ClientIPhoneAndroid etc) 12 ""screenName""  Screen name of the Tweeter    13 ""retweetCount"" Number of Retweets  14 ""isRetweet""  TRUE/FALSE     15 ""retweeted""  Has this tweet been retweeted(TRUE/FALSE) 16 ""longitude""  longitude   17 ""latitude""  latitude  Some Questions How do the polarity/number of tweets change by time? Which locations had negative sentiments about the Inauguration? What about the Women's March? How to the retweet and mention networks look like for each case? Number of Tweets per Day? Which day has the most activity? What are the other hashtags used?",CSV,,"[gender, politics, internet]",CC0,,,195,2177,8,A look into how social media reacted to Trump's Inauguration,#Inauguration and #WomensMarch Tweets,https://www.kaggle.com/adhok93/inauguration-and-womensmarch-tweets,Wed Feb 08 2017
95,,NOAA,"[year, month, lat, lon_175_180W, lon_170_175W, lon_165_170W, lon_160_165W, lon_155_160W, lon_150_155W, lon_145_150W, lon_140_145W, lon_135_140W, lon_130_135W, lon_125_130W, lon_120_125W, lon_115_120W, lon_110_115W, lon_105_110W, lon_100_105W, lon_95_100W, lon_90_95W, lon_85_90W, lon_80_85W, lon_75_80W, lon_70_75W, lon_65_70W, lon_60_65W, lon_55_60W, lon_50_55W, lon_45_50W, lon_40_45W, lon_35_40W, lon_30_35W, lon_25_30W, lon_20_25W, lon_15_20W, lon_10_15W, lon_5_10W, lon_0_5W, lon_0_5E, lon_5_10E, lon_10_15E, lon_15_20E, lon_20_25E, lon_25_30E, lon_30_35E, lon_35_40E, lon_40_45E, lon_45_50E, lon_50_55E, lon_55_60E, lon_60_65E, lon_65_70E, lon_70_75E, lon_75_80E, lon_80_85E, lon_85_90E, lon_90_95E, lon_95_100E, lon_100_105E, lon_105_110E, lon_110_115E, lon_115_120E, lon_120_125E, lon_125_130E, lon_130_135E, lon_135_140E, lon_140_145E, lon_145_150E, lon_150_155E, lon_155_160E, lon_160_165E, lon_165_170E, lon_170_175E, lon_175_180E]","[numeric, numeric, string, numeric, numeric, numeric, numeric, numeric, numeric, numeric, numeric, numeric, numeric, numeric, numeric, numeric, numeric, numeric, numeric, numeric, numeric, numeric, numeric, numeric, numeric, numeric, numeric, numeric, numeric, numeric, numeric, numeric, numeric, numeric, numeric, numeric, numeric, numeric, numeric, numeric, numeric, numeric, numeric, numeric, numeric, numeric, numeric, numeric, numeric, numeric, numeric, numeric, numeric, numeric, numeric, numeric, numeric, numeric, numeric, numeric, numeric, numeric, numeric, numeric, numeric, numeric, numeric, numeric, numeric, numeric, numeric, numeric, numeric, numeric, numeric]","Global Historical Climatology Network-Monthly (GHCN-M) Context The Global Historical Climatology Network (GHCN) is an integrated database of climate summaries from land surface stations across the globe. This data set contains gridded mean temperature anomalies or departures from a reference value or long-term average from the Global Historical Climatology Network-Monthly (GHCN-M) version 3.2.1 temperature data set. The gridded anomalies were produced from GHCN-M bias corrected data. Each month of data consists of 2592 gridded data points produced on a 5° by 5° basis for the entire globe (72 longitude by 36 latitude grid boxes).  Frequency Monthly Period 1880 to 2016  Content Gridded data for every month from January 1880 to the most recent month is available. The data are temperature anomalies in degrees Celsius. Each gridded value was multiplied by 100 and written to file as an integer. Missing values are represented by the value -9999. The data are formatted by year month latitude and longitude. There are 72 longitude grid values per line -- each grid is labeled as a concatenation of ""lon"" ""w"" or ""e"" then the degree. The latitude is captured in the ""lat"" field where the value indicates the lower bound of a grid cell (e.g. 85 indicates 85-90N whereas -90 indicates 85-90S). Longitude values are written from 180°W to 180°E and latitude values from 90°N to 90°S. This dataset permits the quantification of changes in the mean monthly temperature and precipitation for the earth's surface. Changes in the observing system itself have been carefully removed to allow for the true climate variability at the earth's surface to be represented in the data. Many surface weather stations undergo minor relocations through their history of observation. Stations may also be subject to changes in instrumentation as measurement technology evolves. Further the land use/land cover in the vicinity of an observing site may also change with time. Such modifications to an observing site have the potential to alter a thermometer's microclimate exposure characteristics and/or change the bias of measurements the impact of which can be a systematic shift in the mean level of temperature readings that is unrelated to true climate variations. The process of removing such ""non-climatic"" artifacts in a climate time series is called homogenization. In version 3 of the GHCN-Monthly temperature data the apparent impacts of documented and undocumented inhomogeneities are detected and removed through automated pairwise comparisons of mean monthly temperature series as detailed in Menne and Williams [2009]. Inspiration This granular dataset permits extensive historical analysis of the earth’s climate to answer questions about climate change including how different regions of the planet have been affected by changes in temperature over time. Get started by forking the kernel Mapping Historical Temperature Anomalies with R.  Acknowledgements This data is a product of NOAA's National Centers for Environmental Information (NCEI). It was compiled through the aggregation and analysis of many thousands of weather station records. The compete description of the processes and methods used may be found at https//www.ncdc.noaa.gov/ghcnm/v3.php. The Global Historical Climatology Network-Monthly (GHCN-M) temperature dataset was first developed in the early 1990s (Vose et al. 1992). A second version was released in 1997 following extensive efforts to increase the number of stations and length of the data record (Peterson and Vose 1997). Methods for removing inhomogeneities from the data record associated with non-climatic influences such as changes in instrumentation station environment and observing practices that occur over time were also included in the version 2 release (Peterson and Easterling 1994; Easterling and Peterson 1995). Since that time efforts have focused on continued improvements in dataset development methods including new quality control processes and advanced techniques for removing data inhomogeneities (Menne and Williams 2009). License Public Domain License",CSV,,"[climate, history]",Other,,,871,9707,20,Land and ocean temperature anomalies,Global Historical Climatology Network,https://www.kaggle.com/noaa/global-historical-climatology-network,Mon Oct 24 2016
